[
  {
    "id": "supply_errand_runner",
    "schemaVersion": 2,
    "contentVersion": 1,
    "cost": 3,
    "rarity": "common",
    "lane": "daily",
    "type": "action",
    "fixedSupply": true,
    "tags": [],
    "abilities": [
      {
        "trigger": "onPlay",
        "effects": [
          {
            "op": "gainResource",
            "amount": 1
          },
          {
            "op": "draw",
            "count": 1
          }
        ]
      }
    ],
    "artKey": "supply_errand_runner"
  },
  {
    "id": "supply_milk_bread",
    "schemaVersion": 2,
    "contentVersion": 1,
    "cost": 2,
    "rarity": "common",
    "lane": "daily",
    "type": "action",
    "fixedSupply": true,
    "tags": [],
    "abilities": [
      {
        "trigger": "onPlay",
        "effects": [
          {
            "op": "gainResource",
            "amount": 2
          },
          {
            "op": "heal",
            "amount": 1
          }
        ]
      }
    ],
    "artKey": "supply_milk_bread"
  },
  {
    "id": "supply_print_materials",
    "schemaVersion": 2,
    "contentVersion": 1,
    "cost": 4,
    "rarity": "common",
    "lane": "course",
    "type": "action",
    "fixedSupply": true,
    "tags": [],
    "abilities": [
      {
        "trigger": "onPlay",
        "effects": [
          {
            "op": "gainResource",
            "amount": 3
          }
        ]
      }
    ],
    "artKey": "supply_print_materials"
  }
]
